03:33:58.498398 ARP, Request who-has 192.168.56.101 tell 192.168.56.102, length 28
03:33:58.499036 ARP, Reply 192.168.56.101 is-at 08:00:27:b0:b4:be, length 46
03:34:11.772972 IP 192.168.56.102.60323 > 192.168.56.101.22: Flags [S], seq 1819370862, win 1024, options [mss 1460], length 0
03:34:11.773025 IP 192.168.56.102.60323 > 192.168.56.101.587: Flags [S], seq 1819370862, win 1024, options [mss 1460], length 0
03:34:11.773037 IP 192.168.56.102.60323 > 192.168.56.101.135: Flags [S], seq 1819370862, win 1024, options [mss 1460], length 0
03:34:11.773046 IP 192.168.56.102.60323 > 192.168.56.101.1025: Flags [S], seq 1819370862, win 1024, options [mss 1460], length 0
03:34:11.773054 IP 192.168.56.102.60323 > 192.168.56.101.256: Flags [S], seq 1819370862, win 1024, options [mss 1460], length 0
03:34:11.773062 IP 192.168.56.102.60323 > 192.168.56.101.8080: Flags [S], seq 1819370862, win 1024, options [mss 1460], length 0
03:34:11.773071 IP 192.168.56.102.60323 > 192.168.56.101.995: Flags [S], seq 1819370862, win 1024, options [mss 1460], length 0
03:34:11.773080 IP 192.168.56.102.60323 > 192.168.56.101.3306: Flags [S], seq 1819370862, win 1024, options [mss 1460], length 0
03:34:11.773088 IP 192.168.56.102.60323 > 192.168.56.101.80: Flags [S], seq 1819370862, win 1024, options [mss 1460], length 0
03:34:11.773098 IP 192.168.56.102.60323 > 192.168.56.101.53: Flags [S], seq 1819370862, win 1024, options [mss 1460], length 0
03:34:11.773978 IP 192.168.56.101.22 > 192.168.56.102.60323: Flags [S.], seq 655349746, ack 1819370863, win 5840, options [mss 1460], length 0
03:34:11.773980 IP 192.168.56.101.587 > 192.168.56.102.60323: Flags [R.], seq 0, ack 1819370863, win 0, length 0
03:34:11.773982 IP 192.168.56.101.135 > 192.168.56.102.60323: Flags [R.], seq 0, ack 1819370863, win 0, length 0
03:34:11.773984 IP 192.168.56.101.1025 > 192.168.56.102.60323: Flags [R.], seq 0, ack 1819370863, win 0, length 0
03:34:11.773985 IP 192.168.56.101.256 > 192.168.56.102.60323: Flags [R.], seq 0, ack 1819370863, win 0, length 0
03:34:11.773986 IP 192.168.56.101.8080 > 192.168.56.102.60323: Flags [R.], seq 0, ack 1819370863, win 0, length 0
03:34:11.773987 IP 192.168.56.101.995 > 192.168.56.102.60323: Flags [R.], seq 0, ack 1819370863, win 0, length 0
03:34:11.774033 IP 192.168.56.102.60323 > 192.168.56.101.22: Flags [R], seq 1819370863, win 0, length 0
03:34:11.774180 IP 192.168.56.101.3306 > 192.168.56.102.60323: Flags [S.], seq 658693255, ack 1819370863, win 5840, options [mss 1460], length 0
03:34:11.774182 IP 192.168.56.101.80 > 192.168.56.102.60323: Flags [S.], seq 665176202, ack 1819370863, win 5840, options [mss 1460], length 0
03:34:11.774184 IP 192.168.56.101.53 > 192.168.56.102.60323: Flags [S.], seq 659312526, ack 1819370863, win 5840, options [mss 1460], length 0
03:34:11.774190 IP 192.168.56.102.60323 > 192.168.56.101.3306: Flags [R], seq 1819370863, win 0, length 0
03:34:11.774204 IP 192.168.56.102.60323 > 192.168.56.101.80: Flags [R], seq 1819370863, win 0, length 0
03:34:11.774213 IP 192.168.56.102.60323 > 192.168.56.101.53: Flags [R], seq 1819370863, win 0, length 0
03:34:11.774381 IP 192.168.56.102.60323 > 192.168.56.101.110: Flags [S], seq 1819370862, win 1024, options [mss 1460], length 0
03:34:11.774397 IP 192.168.56.102.60323 > 192.168.56.101.143: Flags [S], seq 1819370862, win 1024, options [mss 1460], length 0
03:34:11.774408 IP 192.168.56.102.60323 > 192.168.56.101.21: Flags [S], seq 1819370862, win 1024, options [mss 1460], length 0
03:34:11.774419 IP 192.168.56.102.60323 > 192.168.56.101.3389: Flags [S], seq 1819370862, win 1024, options [mss 1460], length 0
03:34:11.774427 IP 192.168.56.102.60323 > 192.168.56.101.1720: Flags [S], seq 1819370862, win 1024, options [mss 1460], length 0
03:34:11.774436 IP 192.168.56.102.60323 > 192.168.56.101.445: Flags [S], seq 1819370862, win 1024, options [mss 1460], length 0
03:34:11.774444 IP 192.168.56.102.60323 > 192.168.56.101.139: Flags [S], seq 1819370862, win 1024, options [mss 1460], length 0
03:34:11.774451 IP 192.168.56.102.60323 > 192.168.56.101.443: Flags [S], seq 1819370862, win 1024, options [mss 1460], length 0
03:34:11.774459 IP 192.168.56.102.60323 > 192.168.56.101.111: Flags [S], seq 1819370862, win 1024, options [mss 1460], length 0
03:34:11.774466 IP 192.168.56.102.60323 > 192.168.56.101.113: Flags [S], seq 1819370862, win 1024, options [mss 1460], length 0
03:34:11.774475 IP 192.168.56.102.60323 > 192.168.56.101.199: Flags [S], seq 1819370862, win 1024, options [mss 1460], length 0
03:34:11.774483 IP 192.168.56.102.60323 > 192.168.56.101.8888: Flags [S], seq 1819370862, win 1024, options [mss 1460], length 0
03:34:11.774491 IP 192.168.56.102.60323 > 192.168.56.101.25: Flags [S], seq 1819370862, win 1024, options [mss 1460], length 0
03:34:11.774502 IP 192.168.56.102.60323 > 192.168.56.101.23: Flags [S], seq 1819370862, win 1024, options [mss 1460], length 0
03:34:11.774577 IP 192.168.56.102.60323 > 192.168.56.101.5900: Flags [S], seq 1819370862, win 1024, options [mss 1460], length 0
03:34:11.774590 IP 192.168.56.102.60323 > 192.168.56.101.1723: Flags [S], seq 1819370862, win 1024, options [mss 1460], length 0
03:34:11.774599 IP 192.168.56.102.60323 > 192.168.56.101.554: Flags [S], seq 1819370862, win 1024, options [mss 1460], length 0
03:34:11.774607 IP 192.168.56.102.60323 > 192.168.56.101.993: Flags [S], seq 1819370862, win 1024, options [mss 1460], length 0
03:34:11.774618 IP 192.168.56.102.60323 > 192.168.56.101.5960: Flags [S], seq 1819370862, win 1024, options [mss 1460], length 0
03:34:11.774625 IP 192.168.56.102.60323 > 192.168.56.101.9594: Flags [S], seq 1819370862, win 1024, options [mss 1460], length 0
03:34:11.775020 IP 192.168.56.101.110 > 192.168.56.102.60323: Flags [R.], seq 0, ack 1819370863, win 0, length 0
03:34:11.775132 IP 192.168.56.101.143 > 192.168.56.102.60323: Flags [R.], seq 0, ack 1819370863, win 0, length 0
03:34:11.775135 IP 192.168.56.101.21 > 192.168.56.102.60323: Flags [S.], seq 652248944, ack 1819370863, win 5840, options [mss 1460], length 0
03:34:11.775136 IP 192.168.56.101.3389 > 192.168.56.102.60323: Flags [R.], seq 0, ack 1819370863, win 0, length 0
03:34:11.775138 IP 192.168.56.101.1720 > 192.168.56.102.60323: Flags [R.], seq 0, ack 1819370863, win 0, length 0
03:34:11.775139 IP 192.168.56.101.445 > 192.168.56.102.60323: Flags [S.], seq 661923867, ack 1819370863, win 5840, options [mss 1460], length 0
03:34:11.775141 IP 192.168.56.101.139 > 192.168.56.102.60323: Flags [S.], seq 664751427, ack 1819370863, win 5840, options [mss 1460], length 0
03:34:11.775142 IP 192.168.56.101.443 > 192.168.56.102.60323: Flags [R.], seq 0, ack 1819370863, win 0, length 0
03:34:11.775144 IP 192.168.56.101.111 > 192.168.56.102.60323: Flags [S.], seq 652649661, ack 1819370863, win 5840, options [mss 1460], length 0
03:34:11.775158 IP 192.168.56.102.60323 > 192.168.56.101.21: Flags [R], seq 1819370863, win 0, length 0
03:34:11.775176 IP 192.168.56.102.60323 > 192.168.56.101.445: Flags [R], seq 1819370863, win 0, length 0
03:34:11.775186 IP 192.168.56.102.60323 > 192.168.56.101.139: Flags [R], seq 1819370863, win 0, length 0
03:34:11.775196 IP 192.168.56.102.60323 > 192.168.56.101.111: Flags [R], seq 1819370863, win 0, length 0
03:34:11.775213 IP 192.168.56.101.113 > 192.168.56.102.60323: Flags [R.], seq 0, ack 1819370863, win 0, length 0
03:34:11.775215 IP 192.168.56.101.199 > 192.168.56.102.60323: Flags [R.], seq 0, ack 1819370863, win 0, length 0
03:34:11.775365 IP 192.168.56.101.8888 > 192.168.56.102.60323: Flags [R.], seq 0, ack 1819370863, win 0, length 0
03:34:11.775366 IP 192.168.56.101.25 > 192.168.56.102.60323: Flags [S.], seq 654792632, ack 1819370863, win 5840, options [mss 1460], length 0
03:34:11.775367 IP 192.168.56.101.23 > 192.168.56.102.60323: Flags [S.], seq 666854574, ack 1819370863, win 5840, options [mss 1460], length 0
03:34:11.775371 IP 192.168.56.102.60323 > 192.168.56.101.25: Flags [R], seq 1819370863, win 0, length 0
03:34:11.775383 IP 192.168.56.102.60323 > 192.168.56.101.23: Flags [R], seq 1819370863, win 0, length 0
03:34:11.775458 IP 192.168.56.101.5900 > 192.168.56.102.60323: Flags [S.], seq 654275941, ack 1819370863, win 5840, options [mss 1460], length 0
03:34:11.775459 IP 192.168.56.101.1723 > 192.168.56.102.60323: Flags [R.], seq 0, ack 1819370863, win 0, length 0
03:34:11.775460 IP 192.168.56.101.554 > 192.168.56.102.60323: Flags [R.], seq 0, ack 1819370863, win 0, length 0
03:34:11.775464 IP 192.168.56.102.60323 > 192.168.56.101.5900: Flags [R], seq 1819370863, win 0, length 0
03:34:11.775554 IP 192.168.56.101.993 > 192.168.56.102.60323: Flags [R.], seq 0, ack 1819370863, win 0, length 0
03:34:11.775556 IP 192.168.56.101.5960 > 192.168.56.102.60323: Flags [R.], seq 0, ack 1819370863, win 0, length 0
03:34:11.775557 IP 192.168.56.101.9594 > 192.168.56.102.60323: Flags [R.], seq 0, ack 1819370863, win 0, length 0
03:34:11.775645 IP 192.168.56.102.60323 > 192.168.56.101.1301: Flags [S], seq 1819370862, win 1024, options [mss 1460], length 0
03:34:11.775658 IP 192.168.56.102.60323 > 192.168.56.101.56737: Flags [S], seq 1819370862, win 1024, options [mss 1460], length 0
03:34:11.775666 IP 192.168.56.102.60323 > 192.168.56.101.2399: Flags [S], seq 1819370862, win 1024, options [mss 1460], length 0
03:34:11.775674 IP 192.168.56.102.60323 > 192.168.56.101.2043: Flags [S], seq 1819370862, win 1024, options [mss 1460], length 0
03:34:11.775682 IP 192.168.56.102.60323 > 192.168.56.101.1688: Flags [S], seq 1819370862, win 1024, options [mss 1460], length 0
03:34:11.775692 IP 192.168.56.102.60323 > 192.168.56.101.1100: Flags [S], seq 1819370862, win 1024, options [mss 1460], length 0
03:34:11.775703 IP 192.168.56.102.60323 > 192.168.56.101.5850: Flags [S], seq 1819370862, win 1024, options [mss 1460], length 0
03:34:11.775716 IP 192.168.56.102.60323 > 192.168.56.101.6567: Flags [S], seq 1819370862, win 1024, options [mss 1460], length 0
03:34:11.775730 IP 192.168.56.102.60323 > 192.168.56.101.1010: Flags [S], seq 1819370862, win 1024, options [mss 1460], length 0
03:34:11.775740 IP 192.168.56.102.60323 > 192.168.56.101.4900: Flags [S], seq 1819370862, win 1024, options [mss 1460], length 0
03:34:11.775848 IP 192.168.56.102.60323 > 192.168.56.101.54328: Flags [S], seq 1819370862, win 1024, options [mss 1460], length 0
03:34:11.775863 IP 192.168.56.102.60323 > 192.168.56.101.1863: Flags [S], seq 1819370862, win 1024, options [mss 1460], length 0
03:34:11.775875 IP 192.168.56.102.60323 > 192.168.56.101.5679: Flags [S], seq 1819370862, win 1024, options [mss 1460], length 0
03:34:11.775904 IP 192.168.56.102.60323 > 192.168.56.101.8181: Flags [S], seq 1819370862, win 1024, options [mss 1460], length 0
03:34:11.775918 IP 192.168.56.102.60323 > 192.168.56.101.3017: Flags [S], seq 1819370862, win 1024, options [mss 1460], length 0
03:34:11.775945 IP 192.168.56.102.60323 > 192.168.56.101.5060: Flags [S], seq 1819370862, win 1024, options [mss 1460], length 0
03:34:11.775959 IP 192.168.56.102.60323 > 192.168.56.101.19842: Flags [S], seq 1819370862, win 1024, options [mss 1460], length 0
03:34:11.775968 IP 192.168.56.102.60323 > 192.168.56.101.1494: Flags [S], seq 1819370862, win 1024, options [mss 1460], length 0
03:34:11.776032 IP 192.168.56.102.60323 > 192.168.56.101.1: Flags [S], seq 1819370862, win 1024, options [mss 1460], length 0
03:34:11.776053 IP 192.168.56.101.1301 > 192.168.56.102.60323: Flags [R.], seq 0, ack 1819370863, win 0, length 0
03:34:11.776071 IP 192.168.56.102.60323 > 192.168.56.101.51103: Flags [S], seq 1819370862, win 1024, options [mss 1460], length 0
03:34:11.776084 IP 192.168.56.102.60323 > 192.168.56.101.15742: Flags [S], seq 1819370862, win 1024, options [mss 1460], length 0
03:34:11.776095 IP 192.168.56.102.60323 > 192.168.56.101.417: Flags [S], seq 1819370862, win 1024, options [mss 1460], length 0
03:34:11.776139 IP 192.168.56.101.56737 > 192.168.56.102.60323: Flags [R.], seq 0, ack 1819370863, win 0, length 0
03:34:11.776140 IP 192.168.56.101.2399 > 192.168.56.102.60323: Flags [R.], seq 0, ack 1819370863, win 0, length 0
03:34:11.776153 IP 192.168.56.102.60323 > 192.168.56.101.4449: Flags [S], seq 1819370862, win 1024, options [mss 1460], length 0
03:34:11.776163 IP 192.168.56.102.60323 > 192.168.56.101.8011: Flags [S], seq 1819370862, win 1024, options [mss 1460], length 0
03:34:11.776172 IP 192.168.56.102.60323 > 192.168.56.101.1083: Flags [S], seq 1819370862, win 1024, options [mss 1460], length 0
03:34:11.776180 IP 192.168.56.102.60323 > 192.168.56.101.6779: Flags [S], seq 1819370862, win 1024, options [mss 1460], length 0
03:34:11.776189 IP 192.168.56.102.60323 > 192.168.56.101.2702: Flags [S], seq 1819370862, win 1024, options [mss 1460], length 0
03:34:11.776196 IP 192.168.56.102.60323 > 192.168.56.101.3784: Flags [S], seq 1819370862, win 1024, options [mss 1460], length 0
03:34:11.776203 IP 192.168.56.102.60323 > 192.168.56.101.563: Flags [S], seq 1819370862, win 1024, options [mss 1460], length 0
03:34:11.776210 IP 192.168.56.102.60323 > 192.168.56.101.1082: Flags [S], seq 1819370862, win 1024, options [mss 1460], length 0
03:34:11.776219 IP 192.168.56.102.60323 > 192.168.56.101.9968: Flags [S], seq 1819370862, win 1024, options [mss 1460], length 0
03:34:11.776250 IP 192.168.56.101.2043 > 192.168.56.102.60323: Flags [R.], seq 0, ack 1819370863, win 0, length 0
03:34:11.776291 IP 192.168.56.101.1688 > 192.168.56.102.60323: Flags [R.], seq 0, ack 1819370863, win 0, length 0
03:34:11.776334 IP 192.168.56.102.60323 > 192.168.56.101.1234: Flags [S], seq 1819370862, win 1024, options [mss 1460], length 0
03:34:11.776348 IP 192.168.56.102.60323 > 192.168.56.101.32771: Flags [S], seq 1819370862, win 1024, options [mss 1460], length 0
03:34:11.776359 IP 192.168.56.102.60323 > 192.168.56.101.52869: Flags [S], seq 1819370862, win 1024, options [mss 1460], length 0
03:34:11.776447 IP 192.168.56.102.60323 > 192.168.56.101.2100: Flags [S], seq 1819370862, win 1024, options [mss 1460], length 0
03:34:11.776486 IP 192.168.56.101.1100 > 192.168.56.102.60323: Flags [R.], seq 0, ack 1819370863, win 0, length 0
03:34:11.776488 IP 192.168.56.101.5850 > 192.168.56.102.60323: Flags [R.], seq 0, ack 1819370863, win 0, length 0
03:34:11.776489 IP 192.168.56.101.6567 > 192.168.56.102.60323: Flags [R.], seq 0, ack 1819370863, win 0, length 0
03:34:11.776490 IP 192.168.56.101.1010 > 192.168.56.102.60323: Flags [R.], seq 0, ack 1819370863, win 0, length 0
03:34:11.776491 IP 192.168.56.101.4900 > 192.168.56.102.60323: Flags [R.], seq 0, ack 1819370863, win 0, length 0
03:34:11.776507 IP 192.168.56.102.60323 > 192.168.56.101.56738: Flags [S], seq 1819370862, win 1024, options [mss 1460], length 0
03:34:11.776518 IP 192.168.56.102.60323 > 192.168.56.101.2030: Flags [S], seq 1819370862, win 1024, options [mss 1460], length 0
03:34:11.776561 IP 192.168.56.102.60323 > 192.168.56.101.49160: Flags [S], seq 1819370862, win 1024, options [mss 1460], length 0
03:34:11.776575 IP 192.168.56.101.54328 > 192.168.56.102.60323: Flags [R.], seq 0, ack 1819370863, win 0, length 0
03:34:11.776576 IP 192.168.56.101.1863 > 192.168.56.102.60323: Flags [R.], seq 0, ack 1819370863, win 0, length 0
03:34:11.776577 IP 192.168.56.101.5679 > 192.168.56.102.60323: Flags [R.], seq 0, ack 1819370863, win 0, length 0
03:34:11.776578 IP 192.168.56.101.8181 > 192.168.56.102.60323: Flags [R.], seq 0, ack 1819370863, win 0, length 0
03:34:11.776579 IP 192.168.56.101.3017 > 192.168.56.102.60323: Flags [R.], seq 0, ack 1819370863, win 0, length 0
03:34:11.776592 IP 192.168.56.102.60323 > 192.168.56.101.16012: Flags [S], seq 1819370862, win 1024, options [mss 1460], length 0
03:34:11.776600 IP 192.168.56.102.60323 > 192.168.56.101.6025: Flags [S], seq 1819370862, win 1024, options [mss 1460], length 0
03:34:11.776654 IP 192.168.56.101.5060 > 192.168.56.102.60323: Flags [R.], seq 0, ack 1819370863, win 0, length 0
03:34:11.776709 IP 192.168.56.101.19842 > 192.168.56.102.60323: Flags [R.], seq 0, ack 1819370863, win 0, length 0
03:34:11.776809 IP 192.168.56.101.1494 > 192.168.56.102.60323: Flags [R.], seq 0, ack 1819370863, win 0, length 0
03:34:11.776811 IP 192.168.56.101.1 > 192.168.56.102.60323: Flags [R.], seq 0, ack 1819370863, win 0, length 0
03:34:11.776873 IP 192.168.56.101.51103 > 192.168.56.102.60323: Flags [R.], seq 0, ack 1819370863, win 0, length 0
03:34:11.776874 IP 192.168.56.101.15742 > 192.168.56.102.60323: Flags [R.], seq 0, ack 1819370863, win 0, length 0
03:34:11.776876 IP 192.168.56.101.417 > 192.168.56.102.60323: Flags [R.], seq 0, ack 1819370863, win 0, length 0
03:34:11.776877 IP 192.168.56.101.4449 > 192.168.56.102.60323: Flags [R.], seq 0, ack 1819370863, win 0, length 0
03:34:11.776940 IP 192.168.56.101.8011 > 192.168.56.102.60323: Flags [R.], seq 0, ack 1819370863, win 0, length 0
03:34:11.776941 IP 192.168.56.101.1083 > 192.168.56.102.60323: Flags [R.], seq 0, ack 1819370863, win 0, length 0
03:34:11.776942 IP 192.168.56.101.6779 > 192.168.56.102.60323: Flags [R.], seq 0, ack 1819370863, win 0, length 0
03:34:11.777004 IP 192.168.56.101.2702 > 192.168.56.102.60323: Flags [R.], seq 0, ack 1819370863, win 0, length 0
03:34:11.777055 IP 192.168.56.101.3784 > 192.168.56.102.60323: Flags [R.], seq 0, ack 1819370863, win 0, length 0
03:34:11.777056 IP 192.168.56.101.563 > 192.168.56.102.60323: Flags [R.], seq 0, ack 1819370863, win 0, length 0
03:34:11.777057 IP 192.168.56.101.1082 > 192.168.56.102.60323: Flags [R.], seq 0, ack 1819370863, win 0, length 0
03:34:11.777103 IP 192.168.56.101.9968 > 192.168.56.102.60323: Flags [R.], seq 0, ack 1819370863, win 0, length 0
03:34:11.777104 IP 192.168.56.101.1234 > 192.168.56.102.60323: Flags [R.], seq 0, ack 1819370863, win 0, length 0
03:34:11.777170 IP 192.168.56.101.32771 > 192.168.56.102.60323: Flags [R.], seq 0, ack 1819370863, win 0, length 0
03:34:11.777174 IP 192.168.56.101.52869 > 192.168.56.102.60323: Flags [R.], seq 0, ack 1819370863, win 0, length 0
03:34:11.777442 IP 192.168.56.101.2100 > 192.168.56.102.60323: Flags [R.], seq 0, ack 1819370863, win 0, length 0
03:34:11.777444 IP 192.168.56.101.56738 > 192.168.56.102.60323: Flags [R.], seq 0, ack 1819370863, win 0, length 0
03:34:11.777445 IP 192.168.56.101.2030 > 192.168.56.102.60323: Flags [R.], seq 0, ack 1819370863, win 0, length 0
03:34:11.777448 IP 192.168.56.101.49160 > 192.168.56.102.60323: Flags [R.], seq 0, ack 1819370863, win 0, length 0
03:34:11.777594 IP 192.168.56.101.16012 > 192.168.56.102.60323: Flags [R.], seq 0, ack 1819370863, win 0, length 0
03:34:11.777596 IP 192.168.56.101.6025 > 192.168.56.102.60323: Flags [R.], seq 0, ack 1819370863, win 0, length 0
03:34:11.777636 IP 192.168.56.102.60323 > 192.168.56.101.6788: Flags [S], seq 1819370862, win 1024, options [mss 1460], length 0
03:34:11.777655 IP 192.168.56.102.60323 > 192.168.56.101.3005: Flags [S], seq 1819370862, win 1024, options [mss 1460], length 0
03:34:11.777663 IP 192.168.56.102.60323 > 192.168.56.101.2998: Flags [S], seq 1819370862, win 1024, options [mss 1460], length 0
03:34:11.777671 IP 192.168.56.102.60323 > 192.168.56.101.33899: Flags [S], seq 1819370862, win 1024, options [mss 1460], length 0
03:34:11.777678 IP 192.168.56.102.60323 > 192.168.56.101.1164: Flags [S], seq 1819370862, win 1024, options [mss 1460], length 0
03:34:11.777685 IP 192.168.56.102.60323 > 192.168.56.101.14441: Flags [S], seq 1819370862, win 1024, options [mss 1460], length 0
03:34:11.777692 IP 192.168.56.102.60323 > 192.168.56.101.8090: Flags [S], seq 1819370862, win 1024, options [mss 1460], length 0
03:34:11.777700 IP 192.168.56.102.60323 > 192.168.56.101.8042: Flags [S], seq 1819370862, win 1024, options [mss 1460], length 0
03:34:11.777710 IP 192.168.56.102.60323 > 192.168.56.101.1455: Flags [S], seq 1819370862, win 1024, options [mss 1460], length 0
03:34:11.777719 IP 192.168.56.102.60323 > 192.168.56.101.700: Flags [S], seq 1819370862, win 1024, options [mss 1460], length 0
03:34:11.777725 IP 192.168.56.102.60323 > 192.168.56.101.1658: Flags [S], seq 1819370862, win 1024, options [mss 1460], length 0
03:34:11.777733 IP 192.168.56.102.60323 > 192.168.56.101.15002: Flags [S], seq 1819370862, win 1024, options [mss 1460], length 0
03:34:11.777775 IP 192.168.56.102.60323 > 192.168.56.101.7676: Flags [S], seq 1819370862, win 1024, options [mss 1460], length 0
03:34:11.777785 IP 192.168.56.102.60323 > 192.168.56.101.27715: Flags [S], seq 1819370862, win 1024, options [mss 1460], length 0
03:34:11.777792 IP 192.168.56.102.60323 > 192.168.56.101.2106: Flags [S], seq 1819370862, win 1024, options [mss 1460], length 0
03:34:11.777833 IP 192.168.56.102.60323 > 192.168.56.101.5950: Flags [S], seq 1819370862, win 1024, options [mss 1460], length 0
03:34:11.777848 IP 192.168.56.102.60323 > 192.168.56.101.19101: Flags [S], seq 1819370862, win 1024, options [mss 1460], length 0
03:34:11.777855 IP 192.168.56.102.60323 > 192.168.56.101.12174: Flags [S], seq 1819370862, win 1024, options [mss 1460], length 0
03:34:11.777862 IP 192.168.56.102.60323 > 192.168.56.101.7741: Flags [S], seq 1819370862, win 1024, options [mss 1460], length 0
03:34:11.777869 IP 192.168.56.102.60323 > 192.168.56.101.668: Flags [S], seq 1819370862, win 1024, options [mss 1460], length 0
03:34:11.777875 IP 192.168.56.102.60323 > 192.168.56.101.49175: Flags [S], seq 1819370862, win 1024, options [mss 1460], length 0
03:34:11.777883 IP 192.168.56.102.60323 > 192.168.56.101.5962: Flags [S], seq 1819370862, win 1024, options [mss 1460], length 0
03:34:11.777889 IP 192.168.56.102.60323 > 192.168.56.101.4443: Flags [S], seq 1819370862, win 1024, options [mss 1460], length 0
03:34:11.777896 IP 192.168.56.102.60323 > 192.168.56.101.5009: Flags [S], seq 1819370862, win 1024, options [mss 1460], length 0
03:34:11.777904 IP 192.168.56.102.60323 > 192.168.56.101.6580: Flags [S], seq 1819370862, win 1024, options [mss 1460], length 0
03:34:11.777911 IP 192.168.56.102.60323 > 192.168.56.101.1111: Flags [S], seq 1819370862, win 1024, options [mss 1460], length 0
03:34:11.777918 IP 192.168.56.102.60323 > 192.168.56.101.5961: Flags [S], seq 1819370862, win 1024, options [mss 1460], length 0
03:34:11.777924 IP 192.168.56.102.60323 > 192.168.56.101.50000: Flags [S], seq 1819370862, win 1024, options [mss 1460], length 0
03:34:11.777933 IP 192.168.56.102.60323 > 192.168.56.101.458: Flags [S], seq 1819370862, win 1024, options [mss 1460], length 0
03:34:11.777939 IP 192.168.56.102.60323 > 192.168.56.101.9900: Flags [S], seq 1819370862, win 1024, options [mss 1460], length 0
03:34:11.777946 IP 192.168.56.102.60323 > 192.168.56.101.8652: Flags [S], seq 1819370862, win 1024, options [mss 1460], length 0
03:34:11.777980 IP 192.168.56.102.60323 > 192.168.56.101.1095: Flags [S], seq 1819370862, win 1024, options [mss 1460], length 0
03:34:11.778033 IP 192.168.56.102.60323 > 192.168.56.101.14000: Flags [S], seq 1819370862, win 1024, options [mss 1460], length 0
03:34:11.778047 IP 192.168.56.102.60323 > 192.168.56.101.9081: Flags [S], seq 1819370862, win 1024, options [mss 1460], length 0
03:34:11.778054 IP 192.168.56.102.60323 > 192.168.56.101.65000: Flags [S], seq 1819370862, win 1024, options [mss 1460], length 0
03:34:11.778061 IP 192.168.56.102.60323 > 192.168.56.101.11967: Flags [S], seq 1819370862, win 1024, options [mss 1460], length 0
03:34:11.778068 IP 192.168.56.102.60323 > 192.168.56.101.3000: Flags [S], seq 1819370862, win 1024, options [mss 1460], length 0
03:34:11.778074 IP 192.168.56.102.60323 > 192.168.56.101.48080: Flags [S], seq 1819370862, win 1024, options [mss 1460], length 0
03:34:11.778081 IP 192.168.56.102.60323 > 192.168.56.101.1138: Flags [S], seq 1819370862, win 1024, options [mss 1460], length 0
03:34:11.778089 IP 192.168.56.102.60323 > 192.168.56.101.15004: Flags [S], seq 1819370862, win 1024, options [mss 1460], length 0
03:34:11.778097 IP 192.168.56.102.60323 > 192.168.56.101.2021: Flags [S], seq 1819370862, win 1024, options [mss 1460], length 0
03:34:11.778104 IP 192.168.56.102.60323 > 192.168.56.101.5986: Flags [S], seq 1819370862, win 1024, options [mss 1460], length 0
03:34:11.778112 IP 192.168.56.102.60323 > 192.168.56.101.2000: Flags [S], seq 1819370862, win 1024, options [mss 1460], length 0
03:34:11.778119 IP 192.168.56.102.60323 > 192.168.56.101.1287: Flags [S], seq 1819370862, win 1024, options [mss 1460], length 0
03:34:11.778126 IP 192.168.56.102.60323 > 192.168.56.101.16001: Flags [S], seq 1819370862, win 1024, options [mss 1460], length 0
03:34:11.778133 IP 192.168.56.102.60323 > 192.168.56.101.20221: Flags [S], seq 1819370862, win 1024, options [mss 1460], length 0
03:34:11.778140 IP 192.168.56.102.60323 > 192.168.56.101.8291: Flags [S], seq 1819370862, win 1024, options [mss 1460], length 0
